,itemId,title,description,pubDate,priceStandard,priceSales,discountRate,saleStatus,mileage,mileageRate,coverSmallUrl,coverLargeUrl,categoryId,categoryName,publisher,rank,customerReviewRank,reviewCount,author,translator,isbn,link,mobileLink,additionalLink
18,354724779,나로서 충분히 괜찮은 사람,"1000만 독자가 믿고 읽는 작가, 김재식이 보내는 따뜻한 응원의 편지“애써 노력하지 않아도 돼. 나는 나로서 충분히 괜찮은 사람이니까”“오늘도 새벽까지 잠 못 이루었나요?” 괜찮은 사람이 되려 노력하느라 지친 당신에게 에세이스트 김재식이 2년 만에 선사하는 따뜻한 공감과 응원의 편지다섯 권의 에세이를 모두 베스트셀러 반열에 올리며 명실공히 한국 대표 에세이스트로서 자리매김한 김재식 작가가 2년 만에 신작 에세이 《나로서 충분히 괜찮은 사람》으로 돌아왔다. 그는 시끄러운 세상을 잠시 뒤로하고 조용한 섬으로 훌쩍 떠나 살면서, 오로지 내 안의 나에 집중하는 삶을 살아보기 시작했다. 그곳에서 ‘내가 진정으로 원하는 것은 무엇인지, 내 안에는 어떤 고민들이 있는지, 앞으로 어떤 모습으로 살아가고 싶은지,...",20220510,16000,14400,10,판매중,800,6,https://bimage.interpark.com/partner/goods_image/4/7/7/9/354724779h.jpg,https://bimage.interpark.com/partner/goods_image/4/7/7/9/354724779s.jpg,102,국내도서,북로망스,19,9.0,3,김재식,,9791191891096,http://book.interpark.com/blog/integration/product/itemDetail.rdo?prdNo=354724779&refererType=8305,http://m.book.interpark.com/view.html?PRD_NO=354724779&SHOP_NO=0000400000,http://book.interpark.com/gate/ippgw.jsp?goods_no=354724779&biz_cd=
19,354763718,저만치 혼자서,"“나는 한 사람의 이웃으로 이 글을 썼다.”삶에 감겨든 글, 글에 감겨든 삶『강산무진』 이후 16년, 김훈 두번째 소설집언제나 운명과 대면하는 인간의 자리에서 글을 써온 김훈의 소설집 『저만치 혼자서』가 출간되었다. 2006년 첫 소설집 『강산무진』을 펴낸 후 집필해온 7편의 단편소설을 묶은 두번째 소설집이다. 이처럼 김훈의 단편은 귀하다. 그가 『칼의 노래』 『현의 노래』 『남한산성』 등 한국문학의 대체 불가능한 명작 장편들을 연달아 발표하며 거장의 반열에 오른 이후로 계속해서 성실한 글쓰기와 자기 갱신을 보여왔음에도 그렇다. 그의 단편은 장편에 비해 일상적인 인물과 사건을 주로 다루는바, 그렇다면 김훈은 자신과 가까운 이웃들의 이야기를 소설로 쓸 때 유독 고심한다는 뜻일까. 인간 개개인의 역사에...",20220601,15000,13500,10,판매중,750,6,https://bimage.interpark.com/partner/goods_image/3/7/1/8/354763718h.jpg,https://bimage.interpark.com/partner/goods_image/3/7/1/8/354763718s.jpg,101,국내도서,문학동네,20,10.0,1,김훈(金薰),,9788954686921,http://book.interpark.com/blog/integration/product/itemDetail.rdo?prdNo=354763718&refererType=8305,http://m.book.interpark.com/view.html?PRD_NO=354763718&SHOP_NO=0000400000,http://book.interpark.com/gate/ippgw.jsp?goods_no=354763718&biz_cd=
20,301554279,그릿(100쇄 기념 리커버 에디션),"성공의 정의는 ‘끝까지 해내는 것’이다!평균보다 떨어지는 IQ, 특별할 것 없는 재능, 불우한 가정환경에도 놀라운 성공을 일궈낸 사람들은 어떻게 그 모든 불리함을 극복하고 최고의 자리에 오를 수 있었을까? 반면, 일류대를 나온 부모, 천재적인 재능 등 성공할 수 있는 모든 조건을 갖춘 것 같아 보이는 사람들이 그저 그런 성취에 머물고 마는 까닭은 무엇일까? 펜실베이니아 대학교의 선구적인 심리학자 앤절라 더크워스는 성공을 추구하는 사람들의 필독서인 『그릿(Grit)』에서 성공의 비결은 재능이 아니라 그녀가 ‘그릿’이라고 부르는 열정과 끈기의 조합에 있음을 보여준다. 100쇄 기념 특별판으로 출간된 이번 책은 고급스러운 블랙 커버에 금박을 가미해 소장 가치를 높였다. ‘그릿’은 자신이 성취하고자 하는...",20190220,16000,14400,10,판매중,800,6,https://bimage.interpark.com/partner/goods_image/4/2/7/9/301554279h.jpg,https://bimage.interpark.com/partner/goods_image/4/2/7/9/301554279s.jpg,117,국내도서,비즈니스북스,21,8.5,3,앤절라 더크워스,김미정,9791162540633,http://book.interpark.com/blog/integration/product/itemDetail.rdo?prdNo=301554279&refererType=8305,http://m.book.interpark.com/view.html?PRD_NO=301554279&SHOP_NO=0000400000,http://book.interpark.com/gate/ippgw.jsp?goods_no=301554279&biz_cd=
21,354725297,세상의 마지막 기차역,"봄이 시작되는 3월, 급행열차 한 대가 탈선해 절벽 아래로 떨어졌다. 수많은 중상자를 낸 이 대형 사고 때문에 유가족은 순식간에 사랑하는 가족, 연인을 잃었다. 그렇게 두 달이 흘렀을까. 사람들 사이에서 이상한 소문이 돌기 시작하는데…. 역에서 가장 가까운 역인 ‘니시유이가하마 역’에 가면 유령이 나타나 사고가 일어난 그날의 열차에 오르도록 도와준다는 것. 단 유령이 제시한 네 가지 규칙을 반드시 지켜야만 한다. 그렇지 않으면 자신도 죽게 된다. 이를 알고도 유가족은 한 치의 망설임도 없이 역으로 향한다. 과연 유령 열차가 완전히 하늘로 올라가 사라지기 전, 사람들은 무사히 열차에 올라 사랑하는 이의 마지막을 함께할 수 있을까.틱톡에 소개되어 일본 독자들 사이에서 크게 입소문이 난 화제작. 현실과 판타지를...",20220509,14000,12600,10,판매중,700,6,https://bimage.interpark.com/partner/goods_image/5/2/9/7/354725297h.jpg,https://bimage.interpark.com/partner/goods_image/5/2/9/7/354725297s.jpg,101,국내도서,모모,22,9.7,6,무라세 다케시(村? 健),김지연,9791191043754,http://book.interpark.com/blog/integration/product/itemDetail.rdo?prdNo=354725297&refererType=8305,http://m.book.interpark.com/view.html?PRD_NO=354725297&SHOP_NO=0000400000,http://book.interpark.com/gate/ippgw.jsp?goods_no=354725297&biz_cd=
22,354808999,원피스 102: 천왕산,"해적왕을 지탱하는 양쪽 날개,목숨을 건 맞대결이 시작된다─!!부활한 루피는 재차 카이도?와 대치!승패를 판가름하는 갈림길에 접어든 두 군웅(群雄)의 싸움, 그 행방은?!한편, 각지에서 간부들과 격투를 이어가는 동료들에게 결판의 시간이 찾아온다.와노쿠니 편 초절정!!'원피스'를 둘러싼 해양 모험 로망!!!",20220630,5500,4950,10,판매중,270,5,https://bimage.interpark.com/partner/goods_image/8/9/9/9/354808999h.jpg,https://bimage.interpark.com/partner/goods_image/8/9/9/9/354808999s.jpg,108,국내도서,대원씨아이,23,0.0,0,오다 에이치로(尾田?一?),,9791169180948,http://book.interpark.com/blog/integration/product/itemDetail.rdo?prdNo=354808999&refererType=8305,http://m.book.interpark.com/view.html?PRD_NO=354808999&SHOP_NO=0000400000,http://book.interpark.com/gate/ippgw.jsp?goods_no=354808999&biz_cd=
23,354725909,최재천의 공부,"시인의 마음으로 생태계를 탐구해온 최재천 교수삶을 위한 공부를 말하다《최재천의 공부》는 동물과 인간을 깊이 관찰해온 최재천 교수가 10여 년 전부터 꼭 쓰고 싶었던 책으로, 지금 이 시대에 꼭 필요한 공부에 관한 생각을 총망라한다. 인생 전반에 걸쳐 공부가 왜 중요하고 우리에게 어떤 영향을 미치는지 살펴보고, 그동안 제대로 논의된 적 없는 대한민국 교육의 현실을 톺아보고 미래상을 그려보며 청사진을 제시한다. 하버드대학교 시절 몸소 체득한 경험, 서울대학교에서 이화여자대학교 교수 시절까지 있었던 강의, 자연과학과 인문학을 넘나드는 통섭적 시야 등이 이 책의 바탕이 되었다.수많은 청소년과 부모, 청년과 중년, 정부와 기업이 자연과학계의 대가인 최재천 교수에게 물었다. “어떻게 좋아하는 일을 찾을 수 있...",20220518,16500,14850,10,판매중,820,6,https://bimage.interpark.com/partner/goods_image/5/9/0/9/354725909h.jpg,https://bimage.interpark.com/partner/goods_image/5/9/0/9/354725909s.jpg,119,국내도서,김영사,24,0.0,0,"최재천(崔在天),안희경",,9788934943457,http://book.interpark.com/blog/integration/product/itemDetail.rdo?prdNo=354725909&refererType=8305,http://m.book.interpark.com/view.html?PRD_NO=354725909&SHOP_NO=0000400000,http://book.interpark.com/gate/ippgw.jsp?goods_no=354725909&biz_cd=
24,354438246,"어서 오세요, 휴남동 서점입니다 (여름 숲 에디션)","※여름 숲 에디션: 매장 구매, 바로드림 구매 시에는 일반판과 랜덤으로 제공됩니다.“받아들여지고 있다는 느낌이이렇게 슬프고도 좋을 줄이야!”브런치북 전자책 출판 프로젝트 수상작! 독자 요청 쇄도로 전격 종이책 출간“책과 서점을 통해 새로운 관계를 만들고, 스스로 일어서기 위해 애쓰는 사람들의 이야기가 깊이 있게 펼쳐진다.”(소설가 김금희 심사평)서울 어디에나 있을 것 같은 동네의 후미진 골목길. 오가는 사람도 많지 않은 가정집들 사이에 평범한 동네 서점 하나가 들어선다. 바로 휴남동 서점! 슬픈 사연을 갖고 있는 사람처럼 얼굴에 아무런 의욕도 보이지 않는 서점 주인 영주는 처음 몇 달간은 자신이 손님인 듯 일은 하지 않고 가만히 앉아 책만 읽는다. 그렇게 잃어버린 것들을 하나둘 되찾는 기분으로 ...",20220117,15000,13500,10,판매중,750,6,https://bimage.interpark.com/partner/goods_image/8/2/4/6/354438246h.jpg,https://bimage.interpark.com/partner/goods_image/8/2/4/6/354438246s.jpg,101,국내도서,클레이하우스,25,9.6,3,황보름,,9791197377143,http://book.interpark.com/blog/integration/product/itemDetail.rdo?prdNo=354438246&refererType=8305,http://m.book.interpark.com/view.html?PRD_NO=354438246&SHOP_NO=0000400000,http://book.interpark.com/gate/ippgw.jsp?goods_no=354438246&biz_cd=
25,354679562,내가 틀릴 수도 있습니다,"때 이른 성공을 버리고 떠난 17년간의 숲속 수행, 그리고 삶과 죽음의 경계에서 깨달은 것들“불안의 폭풍우 속에 있는 당신을 구원할 책.”2022년 1월, 한 사람이 세상을 떠났다. ‘망설임도, 두려움도 없이 떠납니다’라는 한마디를 남기고. 그러자 스웨덴 전역에 거대한 애도의 물결이 일었다. 비욘 나티코 린데블라드. 수많은 스웨덴인들을 불안에서 끌어내어 평화와 고요로 이끌었던 그는 2018년 루게릭병에 진단받은 후에도 유쾌하고 따뜻한 지혜를 전하며 살아갔다. 『내가 틀릴 수도 있습니다』는 20대에 눈부신 사회적 성공을 거뒀지만 모든 것을 버리고 숲속으로 17년간 수행을 떠났던 저자의 여정과 깨달음, 그리고 마지막을 담은 책으로 수많은 독자들의 삶에 감동과 용기를 전해주었다. 이 책은 모두가 인생의...",20220418,16000,14400,10,판매중,800,6,https://bimage.interpark.com/partner/goods_image/9/5/6/2/354679562h.jpg,https://bimage.interpark.com/partner/goods_image/9/5/6/2/354679562s.jpg,119,국내도서,다산초당,26,10.0,1,비욘 나티코 린데블라드,박미경,9791130689890,http://book.interpark.com/blog/integration/product/itemDetail.rdo?prdNo=354679562&refererType=8305,http://m.book.interpark.com/view.html?PRD_NO=354679562&SHOP_NO=0000400000,http://book.interpark.com/gate/ippgw.jsp?goods_no=354679562&biz_cd=
26,343625619,마음이 흐르는 대로,"“정신없이 달려온 삶이 하루아침에 멈추었을 때 깨달았다.‘마음이 흐르는 대로’ 후회 없이 살아가겠노라고.”불치병을 안고 살아가는 마흔넷 정신과 교수가 전하는자신만의 관점으로 단단하게 인생을 살아가는 법“나는 소아정신과 의사로서 쉴 새 없이 바쁘게 살았다. 빠르게 달려가지 않으면 이 소중한 기회와 시간들이 모조리 낭비되어 사라질 것이라고 생각했다. 그 누구보다 열심히 일했고 내게 맡겨진 일은 빈틈없이 해내려고 노력했다. 2017년 5월 12일, 지나영이라는 고속열차가 큰 바위를 들이받은 듯 완전히 서버리기 전까지는.”아버지가 외면했던 탄생의 순간부터 어린 시절 내내 겪어야 했던 가난 속에서도 그는 좌절하거나 우울해하지 않았다. 아니, 오히려 남들보다 더 크게 세상을 느끼고 더 담대히 도전...",20201123,16000,14400,10,판매중,800,6,https://bimage.interpark.com/partner/goods_image/5/6/1/9/343625619h.jpg,https://bimage.interpark.com/partner/goods_image/5/6/1/9/343625619s.jpg,102,국내도서,다산북스,27,10.0,5,지나영,,9791130632506,http://book.interpark.com/blog/integration/product/itemDetail.rdo?prdNo=343625619&refererType=8305,http://m.book.interpark.com/view.html?PRD_NO=343625619&SHOP_NO=0000400000,http://book.interpark.com/gate/ippgw.jsp?goods_no=343625619&biz_cd=
27,354540966,하늘과 바람과 별과 시,"서거 77주년 탄생 105주년 기념 ‘하늘과 바람과 별과 시’스테디셀러 『윤동주 전 시집』의 고급양장 뉴 에디션“3국을 아우르며 나날이 인기를 더해가는 영원한 청년 시인!”2022년 윤동주 서거 77주년과 탄생 105주년을 맞아 새롭게 편집한 『윤동주 전 시집 ‘하늘과 바람과 별과 시’』는 윤동주 시인의 작품 전체를 비롯해 발문 및 후기까지를 모두 발굴하여 한 권에 담은 유일한 시집이다. 이 시집은 2017년 윤동주 탄생 100주년을 기념해 소실되지 않은 윤동주의 시와 수필 전체뿐만 아니라, 윤동주를 위해 쓰여진 서문과 후기와 발문 등도 모두 취합하여 발간하여 스테디셀러가 된 『윤동주 전 시집』을 윤동주 서거 77주년을 기념하기 위해 누구나 보기 쉽고 편하게 읽을 수 있도록 깔끔하게 편집과 디자인을...",20220216,13000,11700,10,판매중,650,6,https://bimage.interpark.com/partner/goods_image/0/9/6/6/354540966h.jpg,https://bimage.interpark.com/partner/goods_image/0/9/6/6/354540966s.jpg,102,국내도서,스타북스,28,10.0,4,"윤동주(尹東柱),윤동주100년포럼",,9791157956357,http://book.interpark.com/blog/integration/product/itemDetail.rdo?prdNo=354540966&refererType=8305,http://m.book.interpark.com/view.html?PRD_NO=354540966&SHOP_NO=0000400000,http://book.interpark.com/gate/ippgw.jsp?goods_no=354540966&biz_cd=
28,354761560,설민석의 한국사 대모험 21,"우리 아이 한국사 첫걸음, 〈설민석의 한국사 대모험〉으로 시작하세요!2017년 1권이 처음 출간된 이래, 누적 판매 부수 500만 부라는 경이적인 수치를 기록하며 대한민국 대표 어린이 역사책으로 굳건히 자리매김한 〈설민석의 한국사 대모험〉! 〈설민석의 한국사 대모험〉은 아이들이 처음 접하는 한국사를 재미있는 만화와 깊이 있는 부록으로 쉽고, 재미있고, 유익하게 전달합니다. 이 책은 우리 아이들이 놀이하듯 즐겁게 한국사를 접하며 한국사에 관심을 가지고, 나아가 한국사를 사랑하는 어린이로 성장하게 도와줄 것입니다. 〈설민석의 한국사 대모험〉 21권에서는 〈삼국사기〉 속 ‘온달 열전’을 재미있는 만화로 담아냈습니다. 함께 수록된 〈삼국사기〉 원전과 비교해 읽으며 역사 속 온달을 만나 보세요!21권 줄거리...",20220527,13000,11700,10,판매중,650,6,https://bimage.interpark.com/partner/goods_image/1/5/6/0/354761560h.jpg,https://bimage.interpark.com/partner/goods_image/1/5/6/0/354761560s.jpg,110,국내도서,단꿈아이,29,10.0,4,"설민석,스토리박스",,9791191496208,http://book.interpark.com/blog/integration/product/itemDetail.rdo?prdNo=354761560&refererType=8305,http://m.book.interpark.com/view.html?PRD_NO=354761560&SHOP_NO=0000400000,http://book.interpark.com/gate/ippgw.jsp?goods_no=354761560&biz_cd=
29,322904399,모든 사람을 위한 성경 묵상법,"묵상을 시작하고 묵상이 자라도록 돕는 묵상 실전 매뉴얼『모든 사람을 위한 성경 묵상법』은 묵상을 처음 시작하는 이들도 쉽게 따라할 수 있는 묵상 실전 매뉴얼이다. 또한 이미 묵상을 시작한 이들에게는 묵상의 수준을 한 단계 끌어올리고, 더 나아가 묵상하는 공동체를 세우기 위한 실천과 활용(기도와 적용, 나눔과 예배)을 제시하는 책이기도 하다. 묵상의 어려움을 세세히 살피며 필요한 부분을 구체적으로 설명하기 때문에, 묵상하는 모든 이에게 실제적인 도움과 도전을 줄 것이다.",20191129,15000,13500,10,판매중,750,6,https://bimage.interpark.com/partner/goods_image/4/3/9/9/322904399h.jpg,https://bimage.interpark.com/partner/goods_image/4/3/9/9/322904399s.jpg,120,국내도서,성서유니온,30,10.0,2,김기현,,9788932502205,http://book.interpark.com/blog/integration/product/itemDetail.rdo?prdNo=322904399&refererType=8305,http://m.book.interpark.com/view.html?PRD_NO=322904399&SHOP_NO=0000400000,http://book.interpark.com/gate/ippgw.jsp?goods_no=322904399&biz_cd=
