,itemId,title,description,pubDate,priceStandard,priceSales,discountRate,saleStatus,mileage,mileageRate,coverSmallUrl,coverLargeUrl,categoryId,categoryName,publisher,rank,customerReviewRank,reviewCount,author,translator,isbn,link,mobileLink,additionalLink
0,354750490,역행자,"“절대 읽지 마라! 죽을 때까지 순리자로 살고 싶다면!” 오타쿠 흙수저에서 월 1억 자동 수익을 실현한 무자본 연쇄창업마,라이프해커 자청의 인생 역주행 공식 대공개!대부분의 사람들은 유전자와 본성의 명령을 그대로 따르기 때문에 평범함을 벗어날 수 없다. 하지만 정작 자신은 이를 모른 채 ‘나는 달라’ 하는 자의식에 사로잡혀서 무한 합리화에 빠져 살아간다. 스스로가 얼마나 많은 정신적, 심리적 오류를 저지르는지 알지 못한 채 매일 똑같은 쳇바퀴를 돌 뿐이다. 왜 우리는 진짜 자유를 얻지 못하는가? 왜 늘 돈 이야기를 하면서도 평생 돈에 허덕이는가?저자 역시 스무 살까지는 이런 쳇바퀴에 갇혀 있었기 때문에, 그 상황을 누구보다 잘 알았다.  자청의 첫 책 『역행자』에는 가난한 인생에서 벗어나 경제...",20220530,17500,15750,10,판매중,870,6,https://bimage.interpark.com/partner/goods_image/0/4/9/0/354750490h.jpg,https://bimage.interpark.com/partner/goods_image/0/4/9/0/354750490s.jpg,117,국내도서,웅진지식하우스,1,9.7,7,자청,,9788901260716,http://book.interpark.com/blog/integration/product/itemDetail.rdo?prdNo=354750490&refererType=8305,http://m.book.interpark.com/view.html?PRD_NO=354750490&SHOP_NO=0000400000,http://book.interpark.com/gate/ippgw.jsp?goods_no=354750490&biz_cd=
1,354684672,작별인사,"누구도 도와줄 수 없는 상황, 혼자 헤쳐나가야 한다지켜야 할 약속, 붙잡고 싶은 온기김영하가 『살인자의 기억법』 이후 9 년 만에 내놓는 장편소설 『작별인사』는 그리 멀지 않은 미래를 배경으로, 별안간 삶이 송두리째 뒤흔들린 한 소년의 여정을 좇는다. 유명한 IT 기업의 연구원인 아버지와 쾌적하고 평화롭게 살아가던 철이는 어느날 갑자기 수용소로 끌려가 난생처음 날것의 감정으로 가득한 혼돈의 세계에 맞닥뜨리게 되면서 정신적, 신체적 위기에 직면한다. 동시에 자신처럼 사회에서 배제된 자들을 만나 처음으로 생생한 소속감을 느끼고 따뜻한 우정도 싹틔운다. 철이는 그들과  함께  수용소를 탈출하여 집으로 돌아가기 위해 길을 떠나지만  그 여정에는 피할 수 없는 질문이 기다리고 있다.세계보건기구 WHO가 팬데...",20220502,14000,12600,10,판매중,700,6,https://bimage.interpark.com/partner/goods_image/4/6/7/2/354684672h.jpg,https://bimage.interpark.com/partner/goods_image/4/6/7/2/354684672s.jpg,101,국내도서,복복서가,2,10.0,2,김영하(金英夏),,9791191114225,http://book.interpark.com/blog/integration/product/itemDetail.rdo?prdNo=354684672&refererType=8305,http://m.book.interpark.com/view.html?PRD_NO=354684672&SHOP_NO=0000400000,http://book.interpark.com/gate/ippgw.jsp?goods_no=354684672&biz_cd=
2,354726066,인플레이션에서 살아남기,"40년 만에 찾아온 인플레의 역습, 당신의 자산이 무너지기 시작했다!200만 구독자의 열렬한 사랑을 받는 「삼프로TV」는 경제 분야 1위 유튜브 채널이다. 내로라하는 TOP급 전문가들이 출연해 국내외 시황 등의 정보를 나누는데, 요즘처럼 금리가 뛰어오르고 환율이 고공행진 하는 등 혼란스러운 시장이 펼쳐질 때 독자들이 한마음 한뜻으로 찾는 사람이 있다. 바로 신한은행 WM그룹의 부부장, 오건영 저자다. ‘글로벌 경제 1타 강사’로 불리는 오건영 저자의 또 다른 애칭은 ‘대한민국 최고의 Fed(연준) 전문가’다. 글로벌 시장의 폭주를 막아줄 유일한 파수꾼이 Fed이므로, 이들의 행보가 곧 문제를 해결해줄 실마리가 될 것이다. 오건영 저자의 해설을 들으며 그들의 과거 행적을 되짚어보면 경제는 앞으로 어떤...",20220523,18800,16920,10,판매중,940,6,https://bimage.interpark.com/partner/goods_image/6/0/6/6/354726066h.jpg,https://bimage.interpark.com/partner/goods_image/6/0/6/6/354726066s.jpg,117,국내도서,페이지2북스,3,10.0,3,오건영,,9791190977661,http://book.interpark.com/blog/integration/product/itemDetail.rdo?prdNo=354726066&refererType=8305,http://m.book.interpark.com/view.html?PRD_NO=354726066&SHOP_NO=0000400000,http://book.interpark.com/gate/ippgw.jsp?goods_no=354726066&biz_cd=
3,354630464,기분을 관리하면 인생이 관리된다,"하루를 결정하는 건 그날의 기분이다기분에 따라 그날 하루가 달라진다. 기분이 별로 좋지 않은 날엔 어떤 일을 해도 과정도 결과도 마음에 들지 않는다. 하지만 기분이 좋은 날엔 상대방이 나에게 실수를 하더라도 웃어넘길 수 있는 여유가 생기고, 하루의 모든 것들이 밝고 긍정적이라는 생각이 든다. 우리의 하루를 결정하는 기분. 하지만 기분을 관리하는 일은 쉽지 않다. 하루 안에도 수많은 사람을 만나고, 수많은 상황이 펼쳐지기 때문이다. 내 마음대로 되지 않는 삶을 살아가며, 우리는 나와 맞지 않는 사람과 애써 관계를 이어가기 위해 내 마음과 감정을 조금 더 참아내거나 자신을 깎아내리기도 하고, 상황에 휘둘려 잘못된 선택을 내리기도 한다. 그런 사람들에게 더 이상 자신을 깎아내리거나, 상황에 휘둘리지 않도록. ...",20220412,17600,15840,10,판매중,880,6,https://bimage.interpark.com/partner/goods_image/0/4/6/4/354630464h.jpg,https://bimage.interpark.com/partner/goods_image/0/4/6/4/354630464s.jpg,102,국내도서,클라우디아,4,9.9,1,김다슬,,9791196617127,http://book.interpark.com/blog/integration/product/itemDetail.rdo?prdNo=354630464&refererType=8305,http://m.book.interpark.com/view.html?PRD_NO=354630464&SHOP_NO=0000400000,http://book.interpark.com/gate/ippgw.jsp?goods_no=354630464&biz_cd=
4,354815756,눈물 한 방울,"“나에게 남아 있는 마지막 말은 무엇인가?‘디지로그’ ‘생명자본’에 이은 그것은 ‘눈물 한 방울’이었다.”시대의 지성 이어령이 2019년 11월부터 영면에 들기 한 달 전인 2022년 1월까지삶을 반추하고 죽음을 독대하며 써내려간 미공개 육필원고탁월한 통찰력으로 문명의 패러다임을 제시해온 시대의 지성 이어령이 생의 마지막 순간 남긴 새로운 화두, ‘눈물 한 방울’. 나와 남을 위해 흘리는 작은 눈물방울에서 그는 함께 사는 세상을 위한 희망의 씨앗을 보았다. 어린 시절 어머니와의 추억부터 가장 작아서 가장 큰 가치 ‘눈물 한 방울’까지, 세상을 놀라게 한 자유로운 사유와 창조적 영감부터 병마와 싸우며 가슴과 마음에 묻어두었던 절규까지, 끝까지 펜을 놓지 않고 생명과 죽음을 성찰한 인간 이어령의 마지...",20220630,15800,14220,10,판매중,790,6,https://bimage.interpark.com/partner/goods_image/5/7/5/6/354815756h.jpg,https://bimage.interpark.com/partner/goods_image/5/7/5/6/354815756s.jpg,119,국내도서,김영사,5,0.0,0,이어령(李御寧),,9788934961574,http://book.interpark.com/blog/integration/product/itemDetail.rdo?prdNo=354815756&refererType=8305,http://m.book.interpark.com/view.html?PRD_NO=354815756&SHOP_NO=0000400000,http://book.interpark.com/gate/ippgw.jsp?goods_no=354815756&biz_cd=
5,348921505,불편한 편의점(40만부 기념 벚꽃 에디션),"※ 인터넷 한정 특별판: 매장 구매, 바로드림 구매 시에는 다른 표지의 에디션으로 제공됩니다.원 플러스 원의 기쁨, 삼각김밥 모양의 슬픔, 만 원에 네 번의 폭소가 터지는 곳!힘겨운 시대를 살아가는 우리들에게 다가온 조금 특별한 편의점 이야기누적 판매 40만부 돌파, 2022년 가장 사랑받는 소설★★★전 서점 종합베스트 1위, 2021 올해의 책,★★★국립중앙도서관 사서추천도서, 해외 6개국 판권 수출김호연 작가의 장편소설 『불편한 편의점』이 누적 판매 40만부 돌파를 기념하여 벚꽃 에디션으로 새 단장 했습니다. 2021년 4월에 출간되어 전 연령층의 폭넓은 공감을 얻으며 소설 읽기 바람을 일으킨 『불편한 편의점』의 열기는 지금도 현재진행형입니다. “읽는 내내 마음이 따뜻하고 먹먹했다” “눈...",20210420,14000,12600,10,판매중,700,6,https://bimage.interpark.com/partner/goods_image/1/5/0/5/348921505h.jpg,https://bimage.interpark.com/partner/goods_image/1/5/0/5/348921505s.jpg,101,국내도서,나무옆의자,6,9.8,21,김호연,,9791161571188,http://book.interpark.com/blog/integration/product/itemDetail.rdo?prdNo=348921505&refererType=8305,http://m.book.interpark.com/view.html?PRD_NO=348921505&SHOP_NO=0000400000,http://book.interpark.com/gate/ippgw.jsp?goods_no=348921505&biz_cd=
6,354815913,"유럽도시기행 2: 빈, 부다페스트, 프라하, 드레스덴 편","유시민의 3년 만에 돌아온 신작,《유럽도시기행 2》는 시대의 격랑을 이겨내고 저마다의 방식으로 자신의 존재감을 빛내는 네 도시,빈, 부다페스트, 프라하, 드레스덴의 이야기를 담았다.""이 책은 힘들게 마음먹은 유럽 도시를 알차고 풍성하게 여행하거나 미디어를 통해 어렴풋이 알고 있는 유럽의 도시를 제대로 알고 싶을 때, 누군가 콕콕 찍어서 알려 줬으면 하는 내용이 빼곡히 들어있다. 도시의 매력을 느낄 수 있는 핫플레이스부터, 각 도시의 건축물, 길과 광장, 박물관과 예술품 등 그 무엇을 만나도 당황하지 않을 탄탄한 배경 지식, 도시의 존재감을 만들어낸 세계사적 사건과 인물들, 유럽의 역사와 도시의 역사가 씨줄과 날줄처럼 교차하며 생긴 도시의 서사와 상흔들까지, 우리가 도시를 더 풍성하게 만끽할 수 있는 ...",20220709,17500,15750,10,판매중,870,6,https://bimage.interpark.com/partner/goods_image/5/9/1/3/354815913h.jpg,https://bimage.interpark.com/partner/goods_image/5/9/1/3/354815913s.jpg,119,국내도서,생각의길,7,8.7,1,유시민(柳時敏),,9788965137702,http://book.interpark.com/blog/integration/product/itemDetail.rdo?prdNo=354815913&refererType=8305,http://m.book.interpark.com/view.html?PRD_NO=354815913&SHOP_NO=0000400000,http://book.interpark.com/gate/ippgw.jsp?goods_no=354815913&biz_cd=
7,298189479,해커스 토익 기출 보카 TOEIC VOCA,주제별 연상암기로 토익 영단어 30일 완성1. 토익 기출 보카 30일 완성!2. 주제별 연상암기로 쉽고 재미있게 단어 학습3. 최신 기출 단어 및 출제포인트 수록4. 목표 점수대별 필수 단어로 맞춤 학습 가능5. 출제율 높은 핵심 단어만 골라 효율적으로 학습6. 토익 신유형 대비 〈토익 필수 이디엄 표현〉 수록7. 실전 감각을 키우는 토익 실전문제 13회분 제공(교재 3회+온라인 10회),20220314,12900,11610,10,판매중,640,6,https://bimage.interpark.com/partner/goods_image/9/4/7/9/298189479h.jpg,https://bimage.interpark.com/partner/goods_image/9/4/7/9/298189479s.jpg,,,해커스어학연구소,8,9.2,12,David Cho(데이비드 조),,9788965422785,http://book.interpark.com/blog/integration/product/itemDetail.rdo?prdNo=298189479&refererType=8305,http://m.book.interpark.com/view.html?PRD_NO=298189479&SHOP_NO=0000400000,http://book.interpark.com/gate/ippgw.jsp?goods_no=298189479&biz_cd=
8,354819529,에그박사 7,"생생한 관찰 스토리와 귀여운 생물 도감이 만났다!《에그박사 7》은 인기 키즈 크리에이터 에그박사의 원작 영상을 생생한 관찰 스토리와 귀여운 생물 도감으로 재구성한 자연 생물 관찰 만화입니다. 과학자, 철학가, 예술가의 눈으로 곤충의 삶을 관찰했던 프랑스의 곤충학자 파브르의《곤충기》처럼 에그박사의 눈으로 바라본 신비롭고 놀라운 자연 생물의 이야기가 가득하지요. 주인공 에그박사와 양박사, 웅박사가 자연을 누비며 신기한 생물들을 관찰하는 짜릿한 메인 스토리와 의인화된 곤충들의 서브 스토리의 구성은 자연에 대한 따뜻한 정서 공감을 끌어냄과 동시에 어린이들의 탐구 본능을 일깨워 줄 것입니다. 또한 중간중간 수록된 생물 퀴즈 게임, 생물 도감 그리기, 관찰 보고서 작성하기 등 다양한 워크북 활동은 어린이 독자들의 ...",20220615,14500,13050,10,예약판매,720,6,https://bimage.interpark.com/partner/goods_image/9/5/2/9/354819529h.jpg,https://bimage.interpark.com/partner/goods_image/9/5/2/9/354819529s.jpg,110,국내도서,미래엔아이세움,9,0.0,0,"에그박사,박송이",,9791168412279,http://book.interpark.com/blog/integration/product/itemDetail.rdo?prdNo=354819529&refererType=8305,http://m.book.interpark.com/view.html?PRD_NO=354819529&SHOP_NO=0000400000,http://book.interpark.com/gate/ippgw.jsp?goods_no=354819529&biz_cd=
9,349751212,백년허리 2: 치료편,"서울대 의대 재활의학과 정선근 교수의 스테디셀러인 백년허리1 진단편에 이어서 실제적인 치료 방법을 제시하고 있는 백년허리2 치료편이다. 치료편에서 저자는 허리 통증에서 벗어날 수 있는 방법을 정확히, 구체적으로, 누구나 따라할 수 있도록 설명하고 있다. 일상생활, 운동, 작업 등 허리 아픈 사람이 겪게 되는 모든 상황에서 허리를 어떻게 사용하는 것이 옳은지를 알려주는 말그대로 국민 허리 사용설명서이다.",20210513,18500,16650,10,판매중,920,6,https://bimage.interpark.com/partner/goods_image/1/2/1/2/349751212h.jpg,https://bimage.interpark.com/partner/goods_image/1/2/1/2/349751212s.jpg,126,국내도서,언탱글링,10,0.0,0,정선근,,9791197437311,http://book.interpark.com/blog/integration/product/itemDetail.rdo?prdNo=349751212&refererType=8305,http://m.book.interpark.com/view.html?PRD_NO=349751212&SHOP_NO=0000400000,http://book.interpark.com/gate/ippgw.jsp?goods_no=349751212&biz_cd=
10,354692438,멘탈을 바꿔야 인생이 바뀐다,"국내 최고 성공심리학 전문가 박세니의 2022년 신간인생의 변화는 결국 멘탈에 달려있고, 자신의 삶을 행복하게 만드는 것도 결국 멘탈이다.멍한 상태로 주변 사람의 말을 그대로 믿지 마라. 실제로 실천하고 보여준 자가 아니면 결국 불가능하다는 말을 할 뿐이다. 보여준 자의 말만 철저하게 인정하고 따르면 된다. 그것이 꿈을 이루기 위해 당신이 반드시 기억해야 할 점이다.",20220430,15800,14220,10,판매중,790,6,https://bimage.interpark.com/partner/goods_image/2/4/3/8/354692438h.jpg,https://bimage.interpark.com/partner/goods_image/2/4/3/8/354692438s.jpg,118,국내도서,마인드셋(Mindset),11,9.8,1,박세니,,9791191043761,http://book.interpark.com/blog/integration/product/itemDetail.rdo?prdNo=354692438&refererType=8305,http://m.book.interpark.com/view.html?PRD_NO=354692438&SHOP_NO=0000400000,http://book.interpark.com/gate/ippgw.jsp?goods_no=354692438&biz_cd=
11,354320683,ETS 토익 정기시험 기출문제집 1000 Vol 3 LISTENING(리스닝),"토익은 기출이 답이다! 기출문제 한국 독점출간!정기시험 기출문제와 성우음성으로 목표점수 적중1. 실제 기출문제 전격 공개!이 책에는 정기시험 기출문제 7세트와 ETS 예상문제 3세트가 수록되어 있다. 시험에 나온 토익 문제로 실전 감각을 키우고, 동일한 난이도의 예상문제로 시험에 확실하게 대비하자! ETS 예상문제도 실제 시험과 동일한 성우, 문항 유형 및 난이도 등 기출문제와 싱크로율 100% 스펙을 특징으로 한다.2. 실제 정기시험 성우 음성으로 실전대비!이 책에 수록된 10세트의 LC 음원은 모두 정기시험 성우의 음원이다. 시험장에서 듣게 될 음성으로 공부하면 까다로운 영국식, 호주식 발음도 걱정 없다. 또한 강도 높은 학습을 위해 고속 버전과 소음 버전을 추가로 제공하며, YBM북스닷컴...",20211213,17800,16020,10,판매중,890,6,https://bimage.interpark.com/partner/goods_image/0/6/8/3/354320683h.jpg,https://bimage.interpark.com/partner/goods_image/0/6/8/3/354320683s.jpg,,,YBM,12,10.0,1,ETS,,9788917238532,http://book.interpark.com/blog/integration/product/itemDetail.rdo?prdNo=354320683&refererType=8305,http://m.book.interpark.com/view.html?PRD_NO=354320683&SHOP_NO=0000400000,http://book.interpark.com/gate/ippgw.jsp?goods_no=354320683&biz_cd=
12,269978985,친밀한 이방인,"때로는 삶의 조건을 쟁취하기 위해, 때로는 목숨을 부지하기 위해 삶을 뒤엎는 한 인물의 일생을 추적하다!《달의 바다》로 제12회 문학동네작가상을 수상한 이래 서정적인 문체로 동세대 인간 군상의 생을 연민하고 긍정해온 소설가 정한아의 세 번째 장편소설 『친밀한 이방인』. 한 소설가가 자신의 소설을 훔친 비밀스러운 인물의 행적을 추적해나가는 과정을 그린 이 작품이다. 우리 모두가 필연적으로 속해 있지만 대개는 불완전한 형태일 수밖에 없는 가족이라는 틀에 대해 오랜 시간 사유해온 저자는 이번 작품에서 그 천착의 결과를 미스터리 서사로 풀어내는 새로운 도전을 성공적으로 완수했다.칠 년 동안이나 소설을 쓰지 못한 소설가 ‘나’는 어느 날 신문에서 흥미로운 광고를 발견한다. ‘이 책을 쓴 사람을 찾습니다’라는 ...",20171013,13000,11700,10,판매중,650,6,https://bimage.interpark.com/partner/goods_image/8/9/8/5/269978985h.jpg,https://bimage.interpark.com/partner/goods_image/8/9/8/5/269978985s.jpg,101,국내도서,문학동네,13,9.0,3,정한아,,9788954648523,http://book.interpark.com/blog/integration/product/itemDetail.rdo?prdNo=269978985&refererType=8305,http://m.book.interpark.com/view.html?PRD_NO=269978985&SHOP_NO=0000400000,http://book.interpark.com/gate/ippgw.jsp?goods_no=269978985&biz_cd=
13,354320686,ETS 토익 정기시험 기출문제집 1000 Vol 3 READING(리딩),"토익은 기출이 답이다! 기출문제 한국 독점출간!정기시험 기출문제와 성우음성으로 목표점수 적중1. 실제 기출문제 전격 공개!이 책에는 정기시험 기출문제 7세트와 ETS 토익 예상문제 3세트가 수록되어 있다. 시험에 나온 토익 문제로 실전 감각을 키우고, 동일한 난이도의 예상문제로 시험에 확실하게 대비하자! ETS 예상문제도 실제 시험과 동일한 문항 유형 및 난이도 등 기출과 싱크로율 100% 스펙을 특징으로 한다.2. ETS가 제공하는 표준 점수환산표!출제기관 ETS가 제공하는 최신 표준 점수환산표를 제공한다. 문제를 풀었다면 환산표를 통해 자신의 실력이 어느 정도인지 가늠해 보자.4. ETS 토익 온라인/모바일 학습 지원교재 학습자를 위한 온라인 학습 커뮤니티(www.etstoeicboo...",20211213,17800,16020,10,판매중,890,6,https://bimage.interpark.com/partner/goods_image/0/6/8/6/354320686h.jpg,https://bimage.interpark.com/partner/goods_image/0/6/8/6/354320686s.jpg,,,YBM,14,9.9,1,ETS,,9788917238549,http://book.interpark.com/blog/integration/product/itemDetail.rdo?prdNo=354320686&refererType=8305,http://m.book.interpark.com/view.html?PRD_NO=354320686&SHOP_NO=0000400000,http://book.interpark.com/gate/ippgw.jsp?goods_no=354320686&biz_cd=
14,354469028,부의 추월차선(10주년 스페셜 에디션),"미국 아마존 금융ㆍ사업 분야 1위 국내 유명서점 10년간 종합 베스트셀러가장 빠르게 부자 되는 새로운 공식을 제시해 큰 반향 불러일으킨 책부자 되기 방식의 패러다임을 바꾼 〈부의 추월차선〉이 독자들의 사랑과 지지 속에 한국 출간 10주년을 맞이했다. 이 책은 죽도록 일하며 수십 년 간 아끼고 모아서 휠체어에 탈 때쯤 부자 되는 40년짜리 플랜을 비웃으며 한 살이라도 젊을 때 부자가 되어 은퇴하는 방법을 구체적으로 제시하고 있다. ‘추월차선’을 알고 난 뒤 부의 지도를 다시 그린 사람들은 하나같이 입을 모은다.“추월차선 법칙을 알게 된 뒤 나는 내가 돈에 쪼들리며 사는 이유를 알게 되었고, 그런 인생으로부터 벗어나기로 결심했다. 4년 후 나는 자산을 4배로 불릴 수 있었다.”“이제 나는 부자가...",20220204,17500,15750,10,판매중,870,6,https://bimage.interpark.com/partner/goods_image/9/0/2/8/354469028h.jpg,https://bimage.interpark.com/partner/goods_image/9/0/2/8/354469028s.jpg,117,국내도서,토트,15,9.9,1,엠제이 드마코,신소영,9791187444725,http://book.interpark.com/blog/integration/product/itemDetail.rdo?prdNo=354469028&refererType=8305,http://m.book.interpark.com/view.html?PRD_NO=354469028&SHOP_NO=0000400000,http://book.interpark.com/gate/ippgw.jsp?goods_no=354469028&biz_cd=
15,321757313,백년운동,"서울대 의대 재활의학과 정선근 교수는 그의 새로운 책, ‘백년운동’을 통해서 100세 인생을 건강하고 멋지게 살고 싶은 이들에게 그 방법을 의학적으로 제시하고 있다. 정 교수가 몇 년 전에 출간한, 건강분야의 스테디셀러인 ‘ 백년허리’ , ‘백년 목’이 허리와 목디스크 질환에 대한 새로운 치료법을 대중에게 제시한 책이라면, 이번 신간인 ‘백년운동’은 관절과 척추를 보호하면서 안전하게 운동할 수 있는 운동방법을 제시한 책이다. 운동이 몸에 좋다는 것은 모든 사람이 다 아는 사실이다. 운동이 얼마나 우리 몸에 좋은지는 ‘운동이라는 단 한 가지 자극으로 30조(兆) 개가 넘는 온몸의 세포가 동시에 활성화 된다는 사실’ 하나로도 충분히 잘 알 수 있다. 하지만, 이렇게 좋은 운동, 운동은 최고의 명약이지만,...",20191031,19500,17550,10,판매중,970,6,https://bimage.interpark.com/partner/goods_image/7/3/1/3/321757313h.jpg,https://bimage.interpark.com/partner/goods_image/7/3/1/3/321757313s.jpg,126,국내도서,아티잔,16,9.9,5,정선근,,9791196834005,http://book.interpark.com/blog/integration/product/itemDetail.rdo?prdNo=321757313&refererType=8305,http://m.book.interpark.com/view.html?PRD_NO=321757313&SHOP_NO=0000400000,http://book.interpark.com/gate/ippgw.jsp?goods_no=321757313&biz_cd=
16,354815331,영어독립 365,"영어, 도대체 어디서부터 어떻게 시작해야 할까?영어 잘하기를 꿈꾸는 모든 사람들에게 꼭 필요한 책!365일 매일 영어! 나도 영어 잘할 수 있다!단어만 알아도 상대방이 하는 말을 이해할 수 있고, 의사소통을 할 수 있다. 단어를 다양하게 알게 되면 소통의 폭은 훨씬 더 넓어진다. 〈영어독립단어〉 서비스는 영어 실력이 어떤 레벨이든, 자기 수준에 맞춰 실제로 쓰이는 영어 단어를 우선순위로 정리하여 단어를 더 효율적으로 습득할 수 있도록 돕는 영어학습 서비스이다.《영어독립 365》는 〈영어독립단어〉 서비스를 이용하는 분들이 ‘영어 단어를 공부한 후에, 재미있게 영어를 매일 접할 수 있는 방법이 없을까?’라는 고민에서 시작해 영어독립단어 콘텐츠팀과 신미주 작가가 오랜 시간 함께 집필한 책이다.이 책...",20220629,25000,22500,10,판매중,1250,6,https://bimage.interpark.com/partner/goods_image/5/3/3/1/354815331h.jpg,https://bimage.interpark.com/partner/goods_image/5/3/3/1/354815331s.jpg,,,상상스퀘어,17,0.0,0,"영어독립단어 콘텐츠팀,신미주",,9791197549373,http://book.interpark.com/blog/integration/product/itemDetail.rdo?prdNo=354815331&refererType=8305,http://m.book.interpark.com/view.html?PRD_NO=354815331&SHOP_NO=0000400000,http://book.interpark.com/gate/ippgw.jsp?goods_no=354815331&biz_cd=
17,348974294,백년허리 1: 진단편,"서울대 의대 재활의학과 정선근 교수의 스테디셀러인 ‘백년허리’의 개정증보판이다. 백년허리의 초판에서 고쳐야 할 부분을 대거 보충 하였을 뿐 아니라, 허리 통증은 진화의 축복이라는 요통에 대한 새로운 관점을 제시하고 있다. 요통이 축복이라는 관점은 통증에 대한 올바른 해석이 선행 되어야 한다. 저자는 독자 스스로가 그 해결책의 실마리를 찾을 수 있도록 하는 것이 집필의 목적이라고 하고 있다. 이어서 출간되는 ‘백년허리 2권 치료편’에서는 실제적인 치료 방법이 제시될 예정이다.",20210415,18500,16650,10,판매중,920,6,https://bimage.interpark.com/partner/goods_image/4/2/9/4/348974294h.jpg,https://bimage.interpark.com/partner/goods_image/4/2/9/4/348974294s.jpg,126,국내도서,언탱글링,18,10.0,1,정선근,,9791197437304,http://book.interpark.com/blog/integration/product/itemDetail.rdo?prdNo=348974294&refererType=8305,http://m.book.interpark.com/view.html?PRD_NO=348974294&SHOP_NO=0000400000,http://book.interpark.com/gate/ippgw.jsp?goods_no=348974294&biz_cd=
